{
  "schema_version": "1.0.0",
  "receipt_id": "badc0ffe-9999-4aaa-8bbb-cccccccccccc",
  "request_id": "d4c3b2a1-0987-4654-8210-fedcba987654",
  "status": "conflicted",
  "occurred_at": "2026-07-20T12:01:00Z",
  "space_id": "home_01",
  "authority": {
    "commit_path": "world_commit_service",
    "issuer": "world_commit_service"
  },
  "old_world_revision": 9,
  "conflict": {
    "code": "revision_mismatch",
    "expected_world_revision": 7,
    "actual_world_revision": 9,
    "diff_ref": "conflict_diff://home_01/rev_7_vs_9"
  },
  "trace_id": "trace-g1-002-conflict"
}
